Sheet: Sheet1
A1: ProductID | B1: Total Sales | C1: Manufacturing Cost | D1: Profit
A2: 1 | B2: 199.5 | C2: 2 | D2: =RC[-2]-(10*RC[-1]) -> 179.5
A3: 2 | B3: 558.60000000000002 | C3: 2 | D3: =RC[-2]-(20*RC[-1]) -> 518.60000000000002
A4: 3 | B4: 319.80000000000001 | C4: 1 | D4: =RC[-2]-(20*RC[-1]) -> 299.80000000000001
A5: 4 | B5: 399.75 | C5: 1 | D5: =RC[-2]-(15*RC[-1]) -> 384.75
A6: 5 | B6: 239.90000000000001 | C6: 2.5 | D6: =RC[-2]-(10*RC[-1]) -> 214.90000000000001